{
  "$schema": "https://json-schema.org/draft/2020-12/schema",
  "title": "ScanResult",
  "type": "object",
  "description": "Top-level payload transmitted from the hardware agent to the backend.",
  "required": ["scan_id", "timestamp", "subnet", "scan_mode", "devices", "findings"],
  "properties": {
    "scan_id": {
      "type": "string",
      "description": "Unique identifier for the scan (UUID v4 recommended)",
      "pattern": "^[0-9a-fA-F-]{8,}$"
    },
    "timestamp": {
      "type": "string",
      "format": "date-time",
      "description": "ISO 8601 timestamp when the scan completed"
    },
    "subnet": {
      "type": "string",
      "description": "CIDR range that was scanned",
      "pattern": "^([0-9]{1,3}[.]){3}[0-9]{1,3}/[0-9]{1,2}$"
    },
    "scan_mode": {
      "type": "string",
      "enum": ["quick", "full"],
      "description": "Indicates whether a lightweight or deep scan was executed"
    },
    "devices": {
      "type": "array",
      "items": { "$ref": "device.schema.json" },
      "minItems": 0,
      "description": "List of devices observed during the scan"
    },
    "findings": {
      "type": "array",
      "description": "Findings derived from the scan, either global or device-specific references",
      "items": { "$ref": "finding.schema.json" },
      "minItems": 0,
      "default": []
    },
    "metadata": {
      "type": "object",
      "description": "Optional bag for agent version, runtime info, and counters",
      "additionalProperties": true
    }
  },
  "additionalProperties": false
}
