{
  "scan_id": "b97931f1-aabb-4379-86fa-240de161c9fd",
  "timestamp": "2026-04-21T22:22:56.742755Z",
  "subnet": "192.168.15.0/24",
  "scan_mode": "full",
  "devices": [
    {
      "ip": "192.168.15.1",
      "mac": "C0:3D:D9:48:52:80",
      "hostname": "GPT-2731GN2A4P.GPT-2731GN2A4P",
      "vendor": "MitraStar Technology",
      "ports": [
        {
          "port": 21,
          "protocol": "tcp",
          "state": "filtered",
          "service": "ftp",
          "version": null
        },
        {
          "port": 22,
          "protocol": "tcp",
          "state": "open",
          "service": "ssh",
          "version": "Dropbear sshd 2019.78 protocol 2.0"
        },
        {
          "port": 23,
          "protocol": "tcp",
          "state": "filtered",
          "service": "telnet",
          "version": null
        },
        {
          "port": 53,
          "protocol": "tcp",
          "state": "filtered",
          "service": "domain",
          "version": null
        },
        {
          "port": 80,
          "protocol": "tcp",
          "state": "open",
          "service": "rtsp",
          "version": null
        },
        {
          "port": 161,
          "protocol": "tcp",
          "state": "filtered",
          "service": "snmp",
          "version": null
        },
        {
          "port": 443,
          "protocol": "tcp",
          "state": "filtered",
          "service": "https",
          "version": null
        },
        {
          "port": 7547,
          "protocol": "tcp",
          "state": "filtered",
          "service": "cwmp",
          "version": null
        },
        {
          "port": 16667,
          "protocol": "tcp",
          "state": "open",
          "service": "rtsp",
          "version": null
        }
      ]
    },
    {
      "ip": "192.168.15.32",
      "mac": "9E:52:EC:E7:EE:61",
      "hostname": "192.168.15.32",
      "vendor": "unknown",
      "ports": [
        {
          "port": 36935,
          "protocol": "tcp",
          "state": "open",
          "service": "unknown",
          "version": null
        },
        {
          "port": 42953,
          "protocol": "tcp",
          "state": "open",
          "service": "tcpwrapped",
          "version": null
        },
        {
          "port": 51692,
          "protocol": "tcp",
          "state": "open",
          "service": "unknown",
          "version": null
        },
        {
          "port": 53601,
          "protocol": "tcp",
          "state": "open",
          "service": "unknown",
          "version": null
        },
        {
          "port": 64660,
          "protocol": "tcp",
          "state": "open",
          "service": "unknown",
          "version": null
        }
      ]
    },
    {
      "ip": "192.168.15.71",
      "mac": "00:BF:AF:1A:40:DD",
      "hostname": "192.168.15.71",
      "vendor": "Hui Zhou Gaoshengda Technology",
      "ports": [
        {
          "port": 6466,
          "protocol": "tcp",
          "state": "open",
          "service": "unknown",
          "version": null
        },
        {
          "port": 6467,
          "protocol": "tcp",
          "state": "open",
          "service": "tcpwrapped",
          "version": null
        },
        {
          "port": 8008,
          "protocol": "tcp",
          "state": "open",
          "service": "http",
          "version": null
        },
        {
          "port": 8009,
          "protocol": "tcp",
          "state": "open",
          "service": "ajp13",
          "version": null
        },
        {
          "port": 8443,
          "protocol": "tcp",
          "state": "open",
          "service": "https-alt",
          "version": null
        },
        {
          "port": 9000,
          "protocol": "tcp",
          "state": "open",
          "service": "cslistener",
          "version": null
        },
        {
          "port": 43271,
          "protocol": "tcp",
          "state": "open",
          "service": "tcpwrapped",
          "version": null
        },
        {
          "port": 46538,
          "protocol": "tcp",
          "state": "open",
          "service": "tcpwrapped",
          "version": null
        }
      ]
    },
    {
      "ip": "192.168.15.113",
      "mac": "E0:BB:9E:72:DF:CF",
      "hostname": "192.168.15.113",
      "vendor": "Seiko Epson",
      "ports": [
        {
          "port": 80,
          "protocol": "tcp",
          "state": "open",
          "service": "tcpwrapped",
          "version": null
        },
        {
          "port": 443,
          "protocol": "tcp",
          "state": "open",
          "service": "tcpwrapped",
          "version": null
        },
        {
          "port": 515,
          "protocol": "tcp",
          "state": "open",
          "service": "printer",
          "version": null
        },
        {
          "port": 631,
          "protocol": "tcp",
          "state": "open",
          "service": "tcpwrapped",
          "version": null
        },
        {
          "port": 1865,
          "protocol": "tcp",
          "state": "open",
          "service": "entp",
          "version": null
        },
        {
          "port": 9100,
          "protocol": "tcp",
          "state": "open",
          "service": "jetdirect",
          "version": null
        }
      ]
    },
    {
      "ip": "192.168.15.142",
      "mac": "78:DD:12:68:D3:CA",
      "hostname": "192.168.15.142",
      "vendor": "Arcadyan",
      "ports": []
    },
    {
      "ip": "192.168.15.144",
      "mac": "2A:71:BD:6E:02:1A",
      "hostname": "192.168.15.144",
      "vendor": "unknown",
      "ports": [
        {
          "port": 1467,
          "protocol": "tcp",
          "state": "open",
          "service": "csdmbase",
          "version": null
        },
        {
          "port": 51692,
          "protocol": "tcp",
          "state": "open",
          "service": "unknown",
          "version": null
        },
        {
          "port": 64660,
          "protocol": "tcp",
          "state": "open",
          "service": "unknown",
          "version": null
        }
      ]
    },
    {
      "ip": "192.168.15.179",
      "mac": "8A:46:3C:25:C8:5B",
      "hostname": "192.168.15.179",
      "vendor": "unknown",
      "ports": []
    },
    {
      "ip": "192.168.15.190",
      "mac": "2C:96:82:B3:17:70",
      "hostname": "192.168.15.190",
      "vendor": "MitraStar Technology",
      "ports": [
        {
          "port": 22,
          "protocol": "tcp",
          "state": "open",
          "service": "ssh",
          "version": "Dropbear sshd 2022.83 protocol 2.0"
        },
        {
          "port": 80,
          "protocol": "tcp",
          "state": "open",
          "service": "rtsp",
          "version": null
        },
        {
          "port": 3517,
          "protocol": "tcp",
          "state": "open",
          "service": "802-11-iapp",
          "version": null
        },
        {
          "port": 7547,
          "protocol": "tcp",
          "state": "open",
          "service": "tcpwrapped",
          "version": null
        }
      ]
    },
    {
      "ip": "192.168.15.237",
      "mac": "44:34:A7:63:D0:2A",
      "hostname": "192.168.15.237",
      "vendor": "Commscope",
      "ports": [
        {
          "port": 8080,
          "protocol": "tcp",
          "state": "open",
          "service": "http",
          "version": "FRITZ!Box TR-069 service"
        },
        {
          "port": 8081,
          "protocol": "tcp",
          "state": "open",
          "service": "http",
          "version": "FRITZ!Box TR-069 service"
        },
        {
          "port": 8082,
          "protocol": "tcp",
          "state": "open",
          "service": "blackice-alerts",
          "version": null
        },
        {
          "port": 8083,
          "protocol": "tcp",
          "state": "open",
          "service": "us-srv",
          "version": null
        },
        {
          "port": 56789,
          "protocol": "tcp",
          "state": "open",
          "service": "tcpwrapped",
          "version": null
        },
        {
          "port": 56790,
          "protocol": "tcp",
          "state": "open",
          "service": "tcpwrapped",
          "version": null
        }
      ]
    },
    {
      "ip": "192.168.15.247",
      "mac": "BC:5B:D5:E9:28:E8",
      "hostname": "192.168.15.247",
      "vendor": "Commscope",
      "ports": [
        {
          "port": 8080,
          "protocol": "tcp",
          "state": "open",
          "service": "http",
          "version": "FRITZ!Box TR-069 service"
        },
        {
          "port": 8081,
          "protocol": "tcp",
          "state": "open",
          "service": "http",
          "version": "FRITZ!Box TR-069 service"
        },
        {
          "port": 8082,
          "protocol": "tcp",
          "state": "open",
          "service": "blackice-alerts",
          "version": null
        },
        {
          "port": 8083,
          "protocol": "tcp",
          "state": "open",
          "service": "us-srv",
          "version": null
        },
        {
          "port": 56789,
          "protocol": "tcp",
          "state": "open",
          "service": "tcpwrapped",
          "version": null
        },
        {
          "port": 56790,
          "protocol": "tcp",
          "state": "open",
          "service": "tcpwrapped",
          "version": null
        }
      ]
    },
    {
      "ip": "192.168.15.253",
      "mac": "B0:83:D6:ED:53:D0",
      "hostname": "192.168.15.253",
      "vendor": "Commscope",
      "ports": [
        {
          "port": 8080,
          "protocol": "tcp",
          "state": "open",
          "service": "http",
          "version": "FRITZ!Box TR-069 service"
        },
        {
          "port": 8081,
          "protocol": "tcp",
          "state": "open",
          "service": "http",